<?xml version="1.0" encoding="UTF-8"?>
<share_report xmlns:xsi="http://www.w3.org/2001/XMLSchema-instance" xsi:noNamespaceSchemaLocation="C:\Users\admin\Desktop\share.xsd">
	<Property>
		<ship_name/>
		<call_sign/>
		<voyage_number/>
		<date>2015-12-10</date>
		<voyage_detail>
			<departure>
				<departure_date>2015-12-10</departure_date>
				<departure_time>10:00:00</departure_time>
				<country/>
				<port/>
				<unlo_code/>
				<terminal/>
			</departure>
			<arrival>
				<departure_date>2015-12-10</departure_date>
				<departure_time>10:00:00</departure_time>
				<country/>
				<port/>
				<unlo_code/>
				<terminal/>
			</arrival>
		</voyage_detail>
		<via>
			<port/>
		</via>
		<use_dw_route>true</use_dw_route>
		<use_critial_point>true</use_critial_point>
		<critial_point>
			<point/>
		</critial_point>
		<paper_chart>
			<paper/>
		</paper_chart>
		<voyage_data>
			<maximum_draft/>
			<minimum_ukc/>
			<load_condition/>
			<displacement/>
			<cargo_shipped/>
			<total_distance/>
			<total_streaming_time/>
			<average_speed/>
			<average_slip/>
			<me_revolution_distance/>
			<average_me_rmp/>
		</voyage_data>
		<total_bunker_consumption>
			<ifo/>
			<mdo/>
			<lsfo/>
			<lsmdo/>
		</total_bunker_consumption>
		<average_bunker_consumption_per_nm>
			<ifo/>
			<mdo/>
			<lsfo/>
			<lsmdo/>
		</average_bunker_consumption_per_nm>
		<remark/>
	</Property>
</share_report>
